{
  "all_items_satisfied": false,
  "architecture_section": "architecture.md, section 21, Definition of Done for the complete P0 program",
  "count_matches_declaration": false,
  "declared_count_in_wp25_prose": 14,
  "definition_of_done_version": "pgx-wp25-definition-of-done/1",
  "enumerated_count": 15,
  "findings": [
    {
      "blocking": false,
      "code": "THS6_DOD_DECLARED_COUNT_MISMATCH",
      "detail": "WP-25's own prose declares 14 Definition of Done items; architecture.md, section 21, Definition of Done for the complete P0 program enumerates 15. The two counts disagree.",
      "owner": "architecture/document owner",
      "references": [
        "architecture.md"
      ],
      "resolution": "all 15 enumerated bullets are implemented as P0-DOD-001 through P0-DOD-015 and evaluated separately. No bullet was merged, renumbered or discarded to reach the declared count. The discrepancy is visible and it permits no item to be ignored."
    }
  ],
  "items": [
    {
      "architecture_text": "One integrated web prototype runs the representative workflow.",
      "blockers": [
        {
          "blocking": true,
          "code": "THS6_NO_REAL_ASSESSMENT",
          "detail": "C9: the API has served at least one real assessment (observed 0, required >= 1)",
          "gate_id": "GATE-C",
          "owner": "platform owner"
        },
        {
          "blocking": true,
          "code": "THS6_NO_REAL_ASSESSMENT",
          "detail": "C1: at least one assessment has been computed from governed content (observed 0, required >= 1)",
          "gate_id": "GATE-C",
          "owner": "curation lead"
        }
      ],
      "dod_id": "P0-DOD-001",
      "evidence_ids": [],
      "gate_ids": [
        "GATE-C"
      ],
      "notes": "the prototype exists and renders; what it has never rendered is a result computed from an approved dataset and ruleset",
      "observable_condition": "the web prototype computes and displays an assessment produced from governed content, end to end, at least once",
      "owner": "platform owner",
      "satisfied": false
    },
    {
      "architecture_text": "Assessment facts are deterministic for the same release and input.",
      "blockers": [
        {
          "blocking": true,
          "code": "THS6_NO_ACTIVE_RELEASE",
          "detail": "C8: a release is active (observed False, required is true)",
          "gate_id": "GATE-C",
          "owner": "release approver"
        },
        {
          "blocking": true,
          "code": "THS6_NO_REAL_ASSESSMENT",
          "detail": "C1: at least one assessment has been computed from governed content (observed 0, required >= 1)",
          "gate_id": "GATE-C",
          "owner": "curation lead"
        }
      ],
      "dod_id": "P0-DOD-002",
      "evidence_ids": [],
      "gate_ids": [
        "GATE-C"
      ],
      "notes": "determinism is demonstrated over fixtures; 'for the same release' has no referent while no release is active",
      "observable_condition": "the same input, evaluated twice against the same release, produces byte-identical facts - which requires a release to exist",
      "owner": "release approver",
      "satisfied": false
    },
    {
      "architecture_text": "Every finding has traceable evidence.",
      "blockers": [
        {
          "blocking": true,
          "code": "THS6_NO_REAL_ASSESSMENT",
          "detail": "C4: at least one report has been produced (observed 0, required >= 1)",
          "gate_id": "GATE-C",
          "owner": "curation lead"
        }
      ],
      "dod_id": "P0-DOD-003",
      "evidence_ids": [],
      "gate_ids": [
        "GATE-C"
      ],
      "notes": "no report has been produced, so the property holds vacuously and is recorded as unsatisfied rather than as met",
      "observable_condition": "each finding in a produced report resolves to a governed evidence record",
      "owner": "curation lead",
      "satisfied": false
    },
    {
      "architecture_text": "Missing data is never shown as low/no risk; coverage is separate.",
      "blockers": [
        {
          "blocking": true,
          "code": "THS6_NO_COVERAGE_EXECUTION",
          "detail": "C2: at least one coverage manifest has been executed (observed 0, required >= 1)",
          "gate_id": "GATE-C",
          "owner": "curation lead"
        },
        {
          "blocking": true,
          "code": "THS6_NO_COVERAGE_EXECUTION",
          "detail": "C3: at least one axis is supported by governed coverage (observed 0, required >= 1)",
          "gate_id": "GATE-C",
          "owner": "curation lead"
        }
      ],
      "dod_id": "P0-DOD-004",
      "evidence_ids": [],
      "gate_ids": [
        "GATE-C"
      ],
      "notes": "the invariant is implemented and proven over fixtures; it has never been exercised over governed content because none exists",
      "observable_condition": "coverage is computed over governed content and rendered as its own axis, never folded into a risk value",
      "owner": "curation lead",
      "satisfied": false
    },
    {
      "architecture_text": "Software, dataset, and ruleset are independently versioned and rollback works.",
      "blockers": [
        {
          "blocking": true,
          "code": "THS6_DATASET_NOT_PUBLISHED",
          "detail": "A2: a canonical dataset is published (observed False, required is true)",
          "gate_id": "GATE-A",
          "owner": "data owner"
        },
        {
          "blocking": true,
          "code": "THS6_NO_EXECUTABLE_RULESET",
          "detail": "B5: at least one ruleset is frozen (observed 0, required >= 1)",
          "gate_id": "GATE-B",
          "owner": "curation lead"
        },
        {
          "blocking": true,
          "code": "THS6_DEPLOYMENT_GATE_BLOCKED",
          "detail": "E6: the deployment gate reports PASS in its own artifact (observed 'BLOCKED', required == 'PASS')",
          "gate_id": "GATE-E",
          "owner": "platform owner"
        }
      ],
      "dod_id": "P0-DOD-005",
      "evidence_ids": [],
      "gate_ids": [
        "GATE-A",
        "GATE-B",
        "GATE-E"
      ],
      "notes": "the registry design is implemented; no dataset is published, no ruleset is frozen, and no rollback has been executed",
      "observable_condition": "three independent version identifiers exist for one running system, and a rollback between two released versions has been executed",
      "owner": "release approver",
      "satisfied": false
    },
    {
      "architecture_text": "At least 50 serious validation cases exist, with a preference for 100+.",
      "blockers": [
        {
          "blocking": true,
          "code": "THS6_INSUFFICIENT_VALIDATION_CASES",
          "detail": "D1: at least fifty validation cases exist (observed 0, required >= 50)",
          "gate_id": "GATE-D",
          "owner": "validation owner"
        }
      ],
      "dod_id": "P0-DOD-006",
      "evidence_ids": [],
      "gate_ids": [
        "GATE-D"
      ],
      "notes": "zero exist; the seven development cases are excluded by contract and must never be counted towards this bullet",
      "observable_condition": "the validation case store holds at least fifty authored cases",
      "owner": "validation owner",
      "satisfied": false
    },
    {
      "architecture_text": "An independent holdout set was not used for rule development.",
      "blockers": [
        {
          "blocking": true,
          "code": "THS6_NO_HOLDOUT_SET",
          "detail": "D2: an independent holdout set exists (observed 0, required >= 1)",
          "gate_id": "GATE-D",
          "owner": "validation owner"
        }
      ],
      "dod_id": "P0-DOD-007",
      "evidence_ids": [],
      "gate_ids": [
        "GATE-D"
      ],
      "notes": "the separation audit runs and passes over seven development cases, which is a check with nothing to separate them from",
      "observable_condition": "a holdout set exists and the separation audit shows no case in it influenced rule development",
      "owner": "validation owner",
      "satisfied": false
    },
    {
      "architecture_text": "All safety invariants pass in CI.",
      "blockers": [
        {
          "blocking": true,
          "code": "THS6_SAFETY_CI_NOT_EXECUTED",
          "detail": "C6: the safety invariants have been executed by a CI provider (observed False, required is true)",
          "gate_id": "GATE-C",
          "owner": "platform owner"
        },
        {
          "blocking": true,
          "code": "THS6_SAFETY_GATE_BLOCKED",
          "detail": "C5: the safety gate reports PASS in its own artifact (observed 'BLOCKED', required == 'PASS')",
          "gate_id": "GATE-C",
          "owner": "safety owner"
        }
      ],
      "dod_id": "P0-DOD-008",
      "evidence_ids": [],
      "gate_ids": [
        "GATE-C"
      ],
      "notes": "twelve invariants execute locally and pass; the workflow file is configured and has never been run by a provider",
      "observable_condition": "a continuous integration provider has executed the safety gate and recorded every invariant passing",
      "owner": "platform owner",
      "satisfied": false
    },
    {
      "architecture_text": "Blind-first expert review is completed under the approved protocol.",
      "blockers": [
        {
          "blocking": true,
          "code": "THS6_EXPERT_PROTOCOL_NOT_APPROVED",
          "detail": "D6: the expert review protocol has a signatory (observed 0, required >= 1)",
          "gate_id": "GATE-D",
          "owner": "expert review chair"
        },
        {
          "blocking": true,
          "code": "THS6_NO_COMPLETED_REVIEW",
          "detail": "D8: at least one expert review is completed (observed null (no measurement was taken), required >= 1)",
          "gate_id": "GATE-D",
          "owner": "expert review chair"
        }
      ],
      "dod_id": "P0-DOD-009",
      "evidence_ids": [],
      "gate_ids": [